{"bindings":{"build08a_authorization_sha256":"4eedc443d4f1d5c0af36e696fc67fd0101f6936d78edba19d5c20d41ab2b8da8","build09_contract_sha256":"0b9e0cc9c98274f9efcbed451905fa21857c33f0ec9472254fa6e3b803c24a0c","build09e1_evidence_resolution_sha256":"f75c44bcb834090277588b3c23cfe48f00e965c947754497f64831d4b47b9b65","build09e1_predecessor_commit":"ee4bbc1bf4dc5d70032dcd3129801039f3813a36","build09e2_applicability_resolution_sha256":"1a4a406da130eb34a7f6871e92230d0c82fe4bcf9e475651418780bedd5d1262","build09e_evidence_closure_sha256":"bfee262f17b5bc99ff8e55f6b284917cf5507aaa80b0e3bae2454e35da4fbaed"},"contract_version":"build-09e2-successor/1.0","created_on":"2026-08-21","human_policy_required_items":["J13/J17 production binding for supported source version/package/scope","numeric hatch angle within official diagonal semantics","hatch resource or procedural implementation","annotation placement and collision algorithm","line 0.20 mm to MapLibre/device conversion","official black RGB (0,0,0) to output-profile representation"],"next_stage":"BUILD-09F — Human Building Production Policy Resolution","official_portrayal_activation_forbidden":true,"official_portrayal_semantics":{"annotation":{"collision_suppression":{"official_semantics":"avoid interference with features and other annotations","outcome":"local-policy-required","unofficial_detail":"priority, fit, and suppression algorithm"},"content":{"outcome":"officially-supported","rule":"floor count followed by structure"},"field_binding":{"outcome":"documented-source-semantics","rule":"{BUILD_NO}{BUILD_STR}","scope":"112 multidimensional source package only"},"formatting_order":{"outcome":"documented-source-semantics","rule":"floor then structure; exact typography and separator remain local policy"},"placement":{"official_semantics":"center in or near the feature at an appropriate location; do not cover the feature; avoid mapped features, control points, and grid lines","outcome":"local-policy-required","unofficial_detail":"exact anchor algorithm"},"scale_visibility":{"official_semantics":null,"outcome":"local-policy-required","unofficial_detail":"web zoom thresholds"}},"colour_code_7":{"authority_boundary":"official table defines semantic black and the original RGB (R-G-B) value (0,0,0); no HEX notation is stated","evidence_ids":["nlsc112v5.4-building-portrayal-row","nlsc112-18-portrayal-code-table"],"official_code":"7","official_hex":null,"original_representation":{"components":[0,0,0],"representation":"RGB值 (R-G-B)","value_text":"(0,0,0)"},"outcome":"official-device-value-established","semantic_name":"黑色"},"hatch_angle":{"forbidden_inference":"diagonal does not establish 45 degrees","outcome":"local-policy-required-with-official-diagonal-semantics","value_degrees":null},"hatch_resource":{"allowed_form":"procedural-or-independently-reviewed-equivalent","created_or_deployed":false,"exact_asset_required":false,"outcome":"local-policy-required"},"hatch_spacing":{"outcome":"officially-supported","unit":"mm","value":2.0},"line_code_2":{"authority_boundary":"official physical/cartographic width is 0.20 mm; device/CSS conversion is not prescribed by the cited table","css_px":null,"device_conversion_authorized":false,"evidence_ids":["nlsc112v5.4-building-portrayal-row","nlsc112-18-portrayal-code-table"],"official_code":"2","official_symbolic_name":"2號線","outcome":"official-physical-width-established","physical_width":{"unit":"mm","value":0.2,"value_text":"0.20"},"source_representation":"圖式線號 table; 單位:mm公釐; code 2; 規格 0.20"}},"output_profile_requirement":{"local_decisions":["physical-mm-to-CSS-pixel conversion","screen scale and DPI assumptions","MapLibre colour serialization without claiming an official HEX value","opacity and antialiasing behavior"],"local_values_selected":false,"must_preserve":["line code 2 physical width 0.20 mm","colour code 7 original RGB (R-G-B) value (0,0,0)"],"pipeline":["official-portrayal-semantics","authorized-local-output-profile","MapLibre-device-representation"],"required":true,"status":"local-output-profile-policy-required"},"polygonz_derived_xy_contract":{"derived_xy_representation":{"authoritative":false,"geometry_repair_permitted":false,"materialization":"ephemeral-or-content-addressed-read-only-cache","non_writing":true,"purpose":"portrayal-only","rendering_consumes_derived_only":true,"source_mutation_capability":false},"legacy_drop_z_path":{"classification":"incompatible","disposition":"bypassed-by-future-non-writing-derived-view-adapter","reuse_as_is_allowed":false},"pipeline":["authoritative-PolygonZ","immutable-source-representation","derived-non-writing-XY-portrayal-view","rendering-adapter"],"production_execution_allowed":false,"provenance_binding_required":["source archive SHA-256","selected source layer and component SHA-256 values","source feature identity","source PolygonZ geometry hash including Z","derivation algorithm and version","source and output CRS","derived XY content hash"],"source_mutation_authority":false,"source_representation":{"authoritative":true,"immutable":true,"write_handle_exposed_to_deriver":false,"z_values_preserved_and_recoverable":true},"status":"production-candidate-design-only"},"production_activation_forbidden":true,"production_binding_policy":{"official_evidence_search_closed":true,"policy_value_selected":false,"selected_layer_id":null,"selection_rule":null,"state":"human-production-binding-policy-required"},"remaining_authoritative_evidence_blockers":[],"runtime_activation_policy":{"contract_status_production_active_allowed":false,"later_separate_authorization_required":true,"official_portrayal_activation_allowed":false,"production_activation_allowed":false,"production_runtime_creation_allowed":false},"schema_version":"nma.building-human-policy-production-contract/1.0","source_mutation_policy":{"derived_output_writeback_allowed":false,"source_geometry_repair_allowed":false,"source_mutation_allowed":false,"source_z_dimension_removal_allowed":false},"status":"human-policy-hold","successor_contract_sha256":"71b7f25239eb001454af61358acb67917d9820957ea4aeb2191ff613ee54a043"}
